<?xml version="1.0"?>
<turistickiVodic xmlns:xsi="http://www.w3.org/2001/XMLSchema-instance" xsi:noNamespaceSchemaLocation="schema.xsd">
  <gradovi>
    <grad pbr="10000">
      <naziv>Zagreb</naziv>
    </grad>
    <grad pbr="21000">
      <naziv>Split</naziv>
    </grad>
    <grad pbr="22000">
      <naziv>Osijek</naziv>
    </grad>
  </gradovi>
  <bolnice>
    <bolnica id="1" pbr="10000" dezurstvo="False">
      <naziv>Rebro</naziv>
      <ulica>Jukićeva 33</ulica>
      <opis>Ovo je opis bolnice Rebro.</opis>
      <radnoVrijeme>0-24</radnoVrijeme>
    </bolnica>
    <bolnica id="2" pbr="21000" dezurstvo="True">
      <naziv>Klinički bolnički centar Split</naziv>
      <ulica>Spinčićeva 1</ulica>
      <opis>
      </opis>
      <radnoVrijeme>
      </radnoVrijeme>
    </bolnica>
    <bolnica id="3" pbr="10000" dezurstvo="True">
      <naziv>KBC Zagreb</naziv>
      <ulica>Šalata 6</ulica>
      <opis>
      </opis>
      <radnoVrijeme>0-24</radnoVrijeme>
    </bolnica>
  </bolnice>
  <muzeji>
    <muzej id="1" pbr="10000" tipMuzeja="Arheološki">
      <naziv>Muzej suvremene umjetnosti</naziv>
      <ulica>Trg hrvatskih velikana 6</ulica>
      <opis>Ovo je opis Muzeja suvremene umjetnosti.</opis>
      <radnoVrijeme>8-20</radnoVrijeme>
    </muzej>
  </muzeji>
  <znamenitosti>
    <znamenitost id="1" pbr="21000" tipZnamenitost="Tvrđava">
      <naziv>Dioklecijanova palača</naziv>
      <ulica>Ante Starčevića 68</ulica>
      <opis>Ovo je opis Dioklecijanove palače.</opis>
      <radnoVrijeme>0-24</radnoVrijeme>
      <datumIzgradnje>2011-12-08</datumIzgradnje>
    </znamenitost>
  </znamenitosti>
  <parkovi>
    <park id="1" pbr="10000" otvoren="False">
      <naziv>Zrinjevac</naziv>
      <ulica>Zrinjevac 8</ulica>
      <opis>Ovo je opis Zrinjevca.</opis>
      <radnoVrijeme>0-24</radnoVrijeme>
    </park>
  </parkovi>
</turistickiVodic>